{
  "bulk_soil_density": 1370.0,
  "dlwrf_avg": 418.656,
  "dlwrf_max": 440.25,
  "dlwrf_net": 143.0,
  "dswrf_avg": 158.848,
  "dswrf_max": 492.25,
  "dswrf_net": -50.832,
  "evapotranspiration": 4.247,
  "precip": 18.5,
  "pres_avg": 1011.644,
  "revision_status": "final",
  "skin_temp_avg": 29.4,
  "skin_temp_max": 40.4,
  "skin_temp_min": 25.4,
  "soilm_0_10cm": 25.697,
  "soilm_100_200cm": 273.625,
  "soilm_10_40cm": 72.813,
  "soilm_40_100cm": 152.203,
  "soilt_0_10cm": 29.5,
  "soilt_100_200cm": 24.4,
  "soilt_10_40cm": 29.8,
  "soilt_40_100cm": 27.7,
  "specific_humidity": 0.014513969421387,
  "timestamp_local": "2023-09-08 00:00:00",
  "timestamp_utc": "2023-09-08 00:00:00",
  "temp_2m_avg": 26.6,
  "v_soilm_0_10cm": 0.257,
  "v_soilm_100_200cm": 0.274,
  "v_soilm_10_40cm": 0.243,
  "v_soilm_40_100cm": 0.254,
  "valid_date": "2023-09-08",
  "wind_10m_spd_avg": 2.505
}